{"baseline_id":"BL-CODE-1","scope_type":"CAPABILITY_UNIT","scope_id":"CU-USER","baseline_type":"CODE","artifact_version":1,"content_hash":"sha256:aaaaaaaaaaaaaaaaaaaaaaaaaaaaaaaaaaaaaaaaaaaaaaaaaaaaaaaaaaaaaaaa","source_revision":"abc123","items":[{"artifact_type":"SOURCE","artifact_ref":"git:abc123","content_hash":"sha256:bbbbbbbbbbbbbbbbbbbbbbbbbbbbbbbbbbbbbbbbbbbbbbbbbbbbbbbbbbbbbbbb"}],"review_record_id":"REVIEW-1","reference_bindings":[],"validity_status":"VALID","created_at":"2026-08-05T12:00:00Z"}
